{
  "schema_version": 3,
  "content_schema": "ieltsband.content.v3",
  "test": "Test 1",
  "variant": "academic",
  "source_document": {
    "pdf_file": "main.pdf",
    "source": "Cambridge IELTS 21 PDF provided for this task",
    "generation": "fresh extraction from source PDF; no repository content files consumed"
  },
  "rendering": {
    "primary": "semantic structured blocks",
    "visual_fallback": "source_pdf_page",
    "question_text_policy": "question groups are explicitly typed; individual question text remains source-page-bound when layout OCR is not reliable"
  },
  "sections": [
    {
      "id": "listening",
      "type": "listening",
      "title": "LISTENING",
      "duration_minutes": 40,
      "parts": [
        {
          "id": "listening-part-1",
          "number": 1,
          "title": "PART 1",
          "question_range": [
            1,
            10
          ],
          "source_pages": [
            11
          ],
          "question_groups": [
            {
              "id": "qgroup-1-6",
              "question_range": [
                1,
                6
              ],
              "question_type": "table_completion",
              "source_pages": [
                11
              ],
              "raw_text": "PART 1 Questions 1-10\nQuestions 1-6\nComplete the table below.\nWrite ONE WORD AND/OR A NUMBER for each answer.\nOyster Bay Sailing Club Courses\nPe [werner [on [omen\nTaster day introduction to sailing | £120 ifbooking one _ | small groups (max\nplace 1 -\npeople)\nLevel 1 basic theory e.g. £200 a6. at\nunderstanding the the end of the\n2 conn AM tHd@S | available | course for all\nfor club members | participants\nbasic sailing skills\nincluding 3 ... [all inclusive (plus a\ninformation USEFUL 5 anne )\nQuestions 7-10\nComplete the notes below.\nWrite ONE WORD ONLY for each answer.\n* _ Participants must be able to swim.\n© Bring suitable clothing, & 7 -mm-.-'j\\'bju\\nunmmuum and toiletries (e.g. shampoo).\n+ Thereisa& — at the club.\n+ Online taining 9 ns are recommended.\n2 10 ... are available for course participants.\n0 9 ane",
              "questions": [
                {
                  "number": 1,
                  "source_pages": [
                    11
                  ],
                  "text_status": "source_page_bound",
                  "text": null
                },
                {
                  "number": 2,
                  "source_pages": [
                    11
                  ],
                  "text_status": "source_page_bound",
                  "text": null
                },
                {
                  "number": 3,
                  "source_pages": [
                    11
                  ],
                  "text_status": "source_page_bound",
                  "text": null
                },
                {
                  "number": 4,
                  "source_pages": [
                    11
                  ],
                  "text_status": "source_page_bound",
                  "text": null
                },
                {
                  "number": 5,
                  "source_pages": [
                    11
                  ],
                  "text_status": "source_page_bound",
                  "text": null
                },
                {
                  "number": 6,
                  "source_pages": [
                    11
                  ],
                  "text_status": "source_page_bound",
                  "text": null
                }
              ]
            },
            {
              "id": "qgroup-7-10",
              "question_range": [
                7,
                10
              ],
              "question_type": "notes_completion",
              "source_pages": [
                11
              ],
              "raw_text": "PART 1 Questions 1-10\nQuestions 1-6\nComplete the table below.\nWrite ONE WORD AND/OR A NUMBER for each answer.\nOyster Bay Sailing Club Courses\nPe [werner [on [omen\nTaster day introduction to sailing | £120 ifbooking one _ | small groups (max\nplace 1 -\npeople)\nLevel 1 basic theory e.g. £200 a6. at\nunderstanding the the end of the\n2 conn AM tHd@S | available | course for all\nfor club members | participants\nbasic sailing skills\nincluding 3 ... [all inclusive (plus a\ninformation USEFUL 5 anne )\nQuestions 7-10\nComplete the notes below.\nWrite ONE WORD ONLY for each answer.\n* _ Participants must be able to swim.\n© Bring suitable clothing, & 7 -mm-.-'j\\'bju\\nunmmuum and toiletries (e.g. shampoo).\n+ Thereisa& — at the club.\n+ Online taining 9 ns are recommended.\n2 10 ... are available for course participants.\n0 9 ane",
              "questions": [
                {
                  "number": 7,
                  "source_pages": [
                    11
                  ],
                  "text_status": "source_page_bound",
                  "text": null
                },
                {
                  "number": 8,
                  "source_pages": [
                    11
                  ],
                  "text_status": "source_page_bound",
                  "text": null
                },
                {
                  "number": 9,
                  "source_pages": [
                    11
                  ],
                  "text_status": "source_page_bound",
                  "text": null
                },
                {
                  "number": 10,
                  "source_pages": [
                    11
                  ],
                  "text_status": "source_page_bound",
                  "text": null
                }
              ]
            }
          ],
          "pages": [
            {
              "pdf_page": 11,
              "printed_page": 10,
              "role": "listening_question_sheet",
              "text": "PART 1 Questions 1-10\nQuestions 1-6\nComplete the table below.\nWrite ONE WORD AND/OR A NUMBER for each answer.\nOyster Bay Sailing Club Courses\nPe [werner [on [omen\nTaster day introduction to sailing | £120 ifbooking one _ | small groups (max\nplace 1 -\npeople)\nLevel 1 basic theory e.g. £200 a6. at\nunderstanding the the end of the\n2 conn AM tHd@S | available | course for all\nfor club members | participants\nbasic sailing skills\nincluding 3 ... [all inclusive (plus a\ninformation USEFUL 5 anne )\nQuestions 7-10\nComplete the notes below.\nWrite ONE WORD ONLY for each answer.\n* _ Participants must be able to swim.\n© Bring suitable clothing, & 7 -mm-.-'j\\'bju\\nunmmuum and toiletries (e.g. shampoo).\n+ Thereisa& — at the club.\n+ Online taining 9 ns are recommended.\n2 10 ... are available for course participants.\n0 9 ane",
              "blocks": [
                {
                  "type": "heading",
                  "text": "PART 1 Questions 1-10"
                },
                {
                  "type": "heading",
                  "text": "Questions 1-6"
                },
                {
                  "type": "instruction",
                  "text": "Complete the table below. Write ONE WORD AND/OR A NUMBER for each answer. Oyster Bay Sailing Club Courses Pe [werner [on [omen Taster day introduction to sailing | £120 ifbooking one _ | small groups (max place 1 - people) Level 1 basic theory e.g. £200 a6. at understanding the the end of the 2 conn AM tHd@S | available | course for all for club members | participants basic sailing skills including 3 ... [all inclusive (plus a information USEFUL 5 anne )"
                },
                {
                  "type": "heading",
                  "text": "Questions 7-10"
                },
                {
                  "type": "instruction",
                  "text": "Complete the notes below. Write ONE WORD ONLY for each answer. * _ Participants must be able to swim. © Bring suitable clothing, & 7 -mm-.-'j\\'bju\\nunmmuum and toiletries (e.g. shampoo). + Thereisa& — at the club. + Online taining 9 ns are recommended. 2 10 ... are available for course participants. 0 9 ane"
                }
              ],
              "visual_fallback": true
            }
          ]
        },
        {
          "id": "listening-part-2",
          "number": 2,
          "title": "PART 2",
          "question_range": [
            11,
            20
          ],
          "source_pages": [
            12,
            13
          ],
          "question_groups": [
            {
              "id": "qgroup-11-16",
              "question_range": [
                11,
                16
              ],
              "question_type": "multiple_choice",
              "source_pages": [
                12
              ],
              "raw_text": "PART 2 Questions 11-20\nQuestions 11-16\nChoose the correct letter, A, B or C.\nWorking as a makeup trainee\n11 What should trainees always expect to get when working on low budget short films?\nA travel expenses\nB aminimum wage\nC meals\n12 According to the speaker, on big budget films trainees may get experience of\n‘A makeup for special effects.\nB working with different ethnicities.\nC creating a variety of hair styles.\n13. The speaker says a problem for makeup artists is\n‘A dealing with difficult directors.\nB being shouted at by their supervisor.\nwaiting around for hours doing nothing,\n14. How did the speaker feel when she met famous actors for the first time?\nA very shy\nB very proud\nC very disappointed\n15 What advice does the speaker give about makeup kits?\n‘A. Always carry a basic kit with you.\nB Only buy the best products for a makeup kit.\nAsk other makeup artists to check your kit.\n16 What advice does the speaker give about creating a portfolio?\nA Keep print and digital photos.\nB Only include a small selection of photos.\nC Get permission to use photos.\n\"",
              "questions": [
                {
                  "number": 11,
                  "source_pages": [
                    12